<?xml version="1.0" encoding="UTF-8"?>
<component-configuration xmlns="http://tis.co.jp/nablarch/component-configuration"
                         xmlns:xsi="http://www.w3.org/2001/XMLSchema-instance"
                         xsi:schemaLocation="http://tis.co.jp/nablarch/component-configuration ./component-configuration.xsd">

  <!-- テスト用設定値 -->
  <config-file file="unit-test.config"/>
  <import file="db-default.xml"/>

  <!-- システム日付、業務日付を固定値に設定 -->
  <component name="dateProvider" class="nablarch.test.FixedSystemTimeProvider">
    <property name="fixedDate" value="20100914123456"/>
  </component>

  <!-- dbInfo -->
  <component name="dbInfo" class="nablarch.test.core.db.GenericJdbcDbInfo">
    <property name="dataSource" ref="dataSource"/>
    <property name="schema" value="${db.user}"/>
  </component>

  <!-- TestDataParser -->
  <component name="testDataParser" class="nablarch.test.core.reader.BasicTestDataParser">
    <property name="testDataReader">
      <component name="xlsReaderForPoi" class="nablarch.test.core.reader.PoiXlsReader"/>
    </property>
    <property name="dbInfo" ref="dbInfo"/>
    <property name="interpreters" ref="interpreters"/>
  </component>

    <!-- テストデータ記法の解釈を行うクラス群 -->
    <list name="interpreters">
        <!-- null変換 -->
        <component class="nablarch.test.core.util.interpreter.NullInterpreter" />
        <!-- 引用符を外す -->
        <component
            class="nablarch.test.core.util.interpreter.QuotationTrimmer" />
        <!-- システム時刻記法 -->
        <component
            class="nablarch.test.core.util.interpreter.DateTimeInterpreter">
            <property name="systemTimeProvider" ref="dateProvider" />
        </component>
        <!-- 文字列増幅 -->
        <component
            class="nablarch.test.core.util.interpreter.CompositeInterpreter">
            <property name="interpreters">
                <list>
                    <component
                        class="nablarch.test.core.util.interpreter.BasicJapaneseCharacterInterpreter" />
                </list>
            </property>
        </component>
    </list>

</component-configuration>
