<?xml version="1.0" encoding="UTF-8"?>
<!--
メッセージ用設定ファイル
-->
<component-configuration
    xmlns="http://tis.co.jp/nablarch/component-configuration"
    xmlns:xsi="http://www.w3.org/2001/XMLSchema-instance"
    xsi:schemaLocation="http://tis.co.jp/nablarch/component-configuration  ../component-configuration.xsd">

  <!-- 文字列リソースのロードモジュール -->
  <component name="stringResourceLoader"
      class="nablarch.core.message.BasicStringResourceLoader">
    <property name="dbManager" ref="defaultDbTransactionManager" />
    <!-- メッセージリソーステーブル名 -->
    <property name="tableName" value="MESSAGE" />
    <!-- メッセージリソーステーブル IDカラム名 -->
    <property name="idColumnName" value="MESSAGE_ID" />
    <!-- メッセージリソーステーブル 言語カラム名 -->
    <property name="langColumnName" value="LANG" />
    <!-- メッセージリソーステーブル メッセージカラム名 -->
    <property name="valueColumnName" value="MESSAGE" />
  </component>

  <!-- 文字列リソースのキャッシュ -->
  <component name="stringResourceCache"
      class="nablarch.core.cache.BasicStaticDataCache">
    <property name="loader" ref="stringResourceLoader" />
    <!-- 初期ロード -->
    <property name="loadOnStartup" value="${loadMessageOnStartUp}" />
  </component>

  <!-- 文字列リソースの保持クラス -->
  <component name="stringResourceHolder"
      class="nablarch.core.message.StringResourceHolder">
    <property name="stringResourceCache" ref="stringResourceCache" />
  </component>
</component-configuration>
