<?xml version="1.0" encoding="UTF-8"?>

<component-configuration
    xmlns:xsi="http://www.w3.org/2001/XMLSchema-instance" xmlns="http://tis.co.jp/nablarch/component-configuration"
    xsi:schemaLocation="http://tis.co.jp/nablarch/component-configuration  https://nablarch.github.io/schema/component-configuration.xsd">

  <!-- ハンドラキュー構成 -->
  <component name="webFrontController" class="nablarch.fw.web.servlet.WebFrontController">
    <property name="handlerQueue">
      <list>
        <component class="nablarch.fw.web.handler.HttpCharacterEncodingHandler"/>

        <component class="nablarch.common.handler.threadcontext.ThreadContextClearHandler"/>

        <component class="nablarch.fw.handler.GlobalErrorHandler"/>


        <component class="nablarch.fw.jaxrs.JaxRsResponseHandler" >
          <property name="responseFinishers">
            <list>
              <component class="nablarch.fw.jaxrs.AdoptHandlerResponseFinisher">
                <property name="handler">
                  <component class="nablarch.fw.web.handler.SecureHandler">
                    <property name="secureResponseHeaderList">
                      <list>
                        <component class="nablarch.fw.web.handler.secure.ContentTypeOptionsHeader" />
                        <component class="nablarch.fw.web.handler.secure.ReferrerPolicyHeader" />
                        <component class="nablarch.fw.web.handler.secure.CacheControlHeader" />
                      </list>
                    </property>
                  </component>
                </property>
              </component>
            </list>
          </property>
        </component>

        <component-ref name="threadContextHandler"/>

        <component class="nablarch.fw.jaxrs.JaxRsAccessLogHandler"/>

        <component-ref name="dbConnectionManagementHandler"/>

        <component-ref name="transactionManagementHandler"/>

        <!-- ホットデプロイハンドラ -->
        <!--　TODO:開発環境で本ハンドラを使用する場合、各PJでホットデプロイ対象となるパッケージを指定すること
        <component class="nablarch.fw.hotdeploy.HotDeployHandler">
          <property name="targetPackages">
            <list>
              <value>com.nablarch.example.app.web.action</value>
              <value>com.nablarch.example.app.web.form</value>
              <value>com.nablarch.example.app.web.core.validation.validator</value>
              <value>com.nablarch.example.app.web.util</value>
            </list>
          </property>
        </component>
        -->

        <component-ref name="packageMapping"/>
      </list>
    </property>
  </component>
</component-configuration>
