<?xml version="1.0" encoding="UTF-8"?>
<component-configuration
    xmlns="http://tis.co.jp/nablarch/component-configuration" xmlns:xsi="http://www.w3.org/2001/XMLSchema-instance"
    xsi:schemaLocation="http://tis.co.jp/nablarch/component-configuration ../../../../../../Nablarch/resources/component-configuration.xsd">

    <!-- メール送信要求IDジェネレータ -->
    <component name="mailRequestIdGenerator"
        class="nablarch.common.idgenerator.TableIdGenerator">
        <property name="tableName" value="ID_GENERATE_MAIL" />
        <property name="idColumnName" value="ID" />
        <property name="noColumnName" value="NO" />
    </component>

    <!-- メール設定 -->
    <component name="mailRequestConfig" class="nablarch.common.mail.MailRequestConfig">
        <!-- デフォルトの返信先メールアドレス -->
        <property name="defaultReplyTo" value="default.reply.to@please.change.me" />
        <!-- デフォルトの差し戻し先メールアドレス -->
        <property name="defaultReturnPath" value="default.return.path@please.change.me" />
        <!-- デフォルトの文字セット -->
        <property name="defaultCharset" value="ISO-2022-JP" />
        <!-- 最大宛先数 -->
        <property name="maxRecipientCount" value="50" />
        <!-- 最大添付ファイルサイズ -->
        <property name="maxAttachedFileSize" value="1048576" />
    </component>

    <!-- 出力ライブラリ(メール送信)のコード値 -->
    <component name="mailConfig" class="nablarch.common.mail.MailConfig">
        <property name="mailRequestSbnId" value="99" />
        <property name="recipientTypeTO" value="0" />
        <property name="recipientTypeCC" value="1" />
        <property name="recipientTypeBCC" value="2" />
        <property name="statusUnsent" value="0" />
        <property name="statusSent" value="1" />
        <property name="statusFailure" value="2" />
        <property name="sendSuccessMessageId" value="SEND_OK000" />
        <property name="sendFailureCode" value="SEND_FAIL0" />
        <property name="mailRequestCountMessageId" value="REQ_COUNT0" />
        <property name="abnormalEndExitCode" value="199" />
    </component>

</component-configuration>